,date,dateYear,dateMonth,dateDay,rating,userName,content
0,20230914,2023,9,14,5,양혜승,자주 이용하지는 않지만 기분전환으로 조그만거 하나씩 사고 있어요..! 생일선물 살때도 괜찮아요 포장이 안돼서 오는게 좀 그렇지만 가격이 싸니까 직접 포장해서 줘요
1,20230914,2023,9,14,5,기쁨이,앱깔고 눈팅만 하다가 전부터 사고싶던게 특가로 떠서 샀어요ㅎㅎ산 물건에 비해 너무큰 상자에 담겨와서 당황했지만 물건은 안전하게 와서 다행~~
2,20230914,2023,9,14,5,빙글뱅글,매장가보다 저렴해서 놀랐어요!!!회원갑쿠폰쓰면 더저렴하고요!!구경하다보면 시간가는줄몰라요 특가행사도 조은거 많드라구요 잘이용하고 있어요!!
3,20230914,2023,9,14,5,Magda,상품보기 편하게 구분되어 있어서 구매하는 입장에서 쇼핑하기 조음 국내에서는 구하기 어려운 아이템도 볼수있음 검수영상 보내줘서 만족 일부러 백화저 갈 시간내지 않아도 되니 시간절약
4,20230914,2023,9,14,5,엄보미,인스타광고보고 접속했는데 사려고했던 아이템말고도 더 마음에 드는게 많아서 절제하느라 혼났어요ㅎㅎ 정품보장 믿고 삽니다 가격이 싸니까 매장에서 못사겠어요ㅠㅠ
5,20230913,2023,9,13,5,다크코코,완전 특템 했어요 ㅋㅋ 한정수량이라 못살줄 알았는데 사서 기분 너무 좋네요 내일 이거 입고 데이트 가려고 합니다ㅋㅋㅋ 발란 짱이였어요
6,20230913,2023,9,13,5,맹강우,안좋은 말들이 많아서 발란서 못샀었는데 친구가 가방 하나들였길래 어디서 샀냐 물어봤더니 여기라고 했네요ㅎ 친구 자기 발란에서 종종 산다는 말 듣고 저도 발란에서 잘 사고 있어요ㅎ
7,20230913,2023,9,13,5,꽃반지,랭킹 구경이 너무 재밌어요 ㅋㅋㅋ 발란에서 벗어나기 힘드네요 ㅋㅋㅋ 계속 예쁜거업뎃 빨리 해주세요!ㅋㅋ
8,20230912,2023,9,12,5,안소리,관부가세 배송비 모두 포함이라 따로 계산하지 않아도 되니 조아요 문의도 친절히 대답해주시고 배송이 좀 늦어져서 짜증낫었는데 다행히 물건 양품으로 받아서 다음에 또 이용하려고요 감사
9,20230912,2023,9,12,5,장혜진,잠자기 전에 생각없이 아이쇼핑하기 조아요 늘어나는 찜목록은 주체할수없지만 위시리스트 하나씩 만들어가는 것도 재미나요 월급받으면 하나씩 지르고 있어요ㅎㅎ매장보다 착한 가격에 살수있어 가능한 일인듯
10,20230912,2023,9,12,5,초록여신,직구하려는데 도통 어려워서 발란까지 왔어요 회원가입 쿠폰쓰니까 꽤 저렴해지더라고요? 덕분에 버버리 가방 기분좋게 샀어요
11,20230912,2023,9,12,5,Mi Cho,정기적으로 이벤트 자주 해주세요 쿠폰도 많이 뿌려주시고 상품 다양하지만 좋은 가격대 상품 더 많이 들어오면 좋겠어요~지금도 좋지만 더 좋아지기를 바래요 언제나 응원합니다ㅎㅎ
12,20230912,2023,9,12,5,우주쏘녀,"지갑사고 탈퇴하려고했는데 할인쿠폰, 포인트 쌓이는거 야금야금 활용하다보니 벌써 5번정도 주문햇네요, 명품 쇼핑은 어렵다고 생각했는데 덕분에 편하게 이용하고 있어요"
13,20230911,2023,9,11,5,Thunderman,핸드폰으로 명품을 살 수 있는 앱이라 좋네요. 무조건 명품은 매장에서 사야한다는 사람인데 지금은 발란에서도 종종 쇼핑하고 있어요. 종류도 다양하고 할인쿠폰이나 이벤트 등도 이용해보면 원래 금액보다 저렴하게도 살 수있어 좋은 것 같습니다.
14,20230911,2023,9,11,5,LAY,울 아빠 생신 선물 처이스하다가 옆에 머플러가 저렴해서 엄마드라려고 사버렸어요..ㅎ 쿠폰 적용하니 오프라인에서 본 가격에 조금만 보태면 두개나 살 수 있겠더라구여! 덕분에 효녀됐습니다. 배송도 엄청빨라요.감사합니다ㅎ_ㅎ
15,20230911,2023,9,11,5,김연희,몽클레어 점퍼 좋은 가격에 구입해서 너무 기분 좋았어요ㅋㅋ사이즈는 매장에서 입어봐서 실패없었어요ㅋㅋ
16,20230911,2023,9,11,5,남바원!,몇달동안 사용해보고 있는데 의외로 손이 마니가는 앱이네요 악세서리나 티셔츠같은거는 눈팅하다가 포인트 합쳐서 사면 부담이 줄어드니 더 쇼핑하게 되는 것 같기도... 즐겁게 쇼핑합니다 감사합니다
17,20230911,2023,9,11,5,손소이,정품 보장해서인지 제가 구매한 것들은 전부 다 찐이였어요. 정품확실하고 온오프 최저가인데 어떻게 모른척하쥬? 이제 여기저기 검색안합니다.(사실 조금하지만) 늘 발란에서만 사게 되네요. 잘쓰고있어요~.~
18,20230911,2023,9,11,1,개미당,쿠폰 너무많뜸 쇼핑 불가할정도로 귀찮게함
19,20230911,2023,9,11,5,생크리미,B최저가 상품 마니 올려주세요ㅠㅠ 가격대 정말 좋은데 품절뜨면 가슴 찢어집니다ㅠㅜㅠㅋㅋ 신상 업데이트할때마다 체크하는데 정말 꿀템 많아요 추천합니다ㅋㅋ
20,20230911,2023,9,11,5,FINGERTIP,지난주 쇼핑갔다가 오프라인에서 본 가방이 계속 아른거려서 검색하다가 우연히 알게 된 발란. 매장가보다 훨씬 저렴하고 받아보니 제품상태 너무 좋구요. 자주 애용하게될것같네요^^
21,20230911,2023,9,11,5,최지아,정품 이슈가 있어서 걱정했는데 지금까지 샀던거 모두 이상없었습니다. 정품 감정도 해봤는데 모두 오케이!!
22,20230910,2023,9,10,5,sooyeon Park,인터넷으로 명품 살수 있는곳
23,20230910,2023,9,10,5,지수호,오~~ 오픈 초기에 가입했다가 올만에 들어왔는데 진짜 많이 개선됐네요ㅋㅋㅋㅋ너무 악평이 많아서 글쓰러왔어요. 보기도 편해지고 소비자의견 반영해서 디벨롭하는거 좋은데요. 확실히 가격이 착하네요.
24,20230910,2023,9,10,5,박혜란,o_o!!! 백화점 판매 가격보다 싸게 구매했어요 ㅋㅋ 개이득~~
25,20230910,2023,9,10,5,문준호,브랜드들이 진짜 다양하고 가격까지 저렴하고 정말좋아요. 덩치가 좀 있어서 110넘어 가는 오버사이즈 찾는게 힘들었는데 발란에는 제품도 많고 다양해서 좋아요!
26,20230909,2023,9,9,3,홍지연,사이즈가 어떨지 의문이긴 하지만 후기가 좋아서 주문합니다.
27,20230908,2023,9,8,5,구준기,배송이 진짜 빠르고 정품보상 참 좋습니다. 저렴한 가격으로 매번 사용해요.
28,20230908,2023,9,8,5,MuGeun jeon,일단 써봄
29,20230907,2023,9,7,5,홍태환,저렴한 가격에 나 자신에게 주는 선물 결제했어요. 선물 빨리 받을 수 있어서 넘 좋아영
30,20230907,2023,9,7,5,원채빈,가격이 너무너무 착해서 정품 감정 받아봤어요... 정품 판정받고 한번 더 감동~~~ 앞으로 백화점 안가도 될것같아요.
31,20230907,2023,9,7,5,DIAMOND,좋아요!!! 저의 최애앱입니다. 추워서 밖에 나가기 싫은데 잘 됐어요ㅎㅎ 따땃하게 집에서 빠르고 간편하게 쇼핑^.~
32,20230906,2023,9,6,5,채동혁,지금까지는 너무너무 만족하며 잘 쓰고 있습니다!!
33,20230906,2023,9,6,5,류연재,화면서 본 그대로 딱 집앞에 도착! 배송도 빨리오니까 기분이 좋아요 ㅎㅎ
34,20230906,2023,9,6,5,YASU,엄마 생일이라서 선물 준비하면서 이용했는데 아주 만족합니다. 무엇보다 엄마가 아주 만족하세요:)
35,20230906,2023,9,6,5,까만여우,어그제 백화점 사이트에서 주문한 것보다 더 저렴해서 결제취소하고 샀어요 ㅋㅋ
36,20230905,2023,9,5,5,부자되쟝,늘 그랫듯 발란은 무조건 약속한 날짜에 딱 맞춰 도착했습니다. 감사합니다.
37,20230904,2023,9,4,4,이현숙,너무이뻐요
38,20230904,2023,9,4,1,이기웅,결재취소 안됨 일부러 오류나게 해놨는지 계속 오류뜸 쓰레기
39,20230904,2023,9,4,5,비타민씨,생각보다 더더 빨리 도착했어요! 너무 고맙습니다. 번창하세요!
40,20230904,2023,9,4,5,엔돌핀한,배송도 정말로 빠르고 핏~~도 좋습니다!!
41,20230904,2023,9,4,1,김우진,별 한 개도 아깝다 고객센터라는게 있긴한건가
42,20230903,2023,9,3,5,염유이,백화점 쇼핑갔더니 사이즈 없어서 못 샀는데.... 발란에서 더 싸게 샀어요>_<
43,20230903,2023,9,3,5,또다른시작,오늘배송!!!! 정말로 혁명이 아닌가요...... 주말 전에 꼭 받길 간절히 원했는데 진짜로 당일에 배송 와서 안도 했어요!!!!
44,20230903,2023,9,3,5,fake it,꾸준히 사용하고 있어용. 상품 업데이트랑 재고 관리를 잘 해서 좋습니당!!
45,20230901,2023,9,1,5,stranger,상품 각각을 판매자별로 최저가를 비교해주니까 너무너무 좋음!! 사이트 여러 곳 발품 팔 필요가 없다니…. ㅜㅜ 자주자주 이용할 거 같아요
46,20230831,2023,8,31,5,주아진,최저가 검색하여서 나온곳이라서 처음 이용해 봤는데…. 검수 영상도 찍어주니까 좀 더 안심하고 사용할 수 있을 거 같네요.
47,20230831,2023,8,31,5,사랑스러워,고객센터가 친절하고 응대도 잘해주시니 너무 호감이었어요. 고가 제품 판매하다보니 이런 서비스가 정말 중요한 거 같아요
48,20230831,2023,8,31,5,허태성,매일매일 최저가 상품을 갱신해주니까 더더 보는 맛이 있어요!!! 저렴하게 명품 건질 수 있는 최고의 쇼핑몰 ㅎㅎㅎ
49,20230831,2023,8,31,5,그레이,결제 이벤트를 많이 해서 좋아요~ 카카오페이 결제 이벤트때 구매하니 할인 많이 받을 수 있네요!!
50,20230830,2023,8,30,5,남소미,브랜드별로 인기상품들도 비교할 수 있어서 좋앙소!! 사실 브랜드 이름만 좀 알고 브랜드 내에서 뭐가 이쁘고 인기 있는건지 제 눈으로는 잘 모르겠는데 ㅋㅋ 랭킹 보면서 도움 많이 받고 있습니다.
51,20230830,2023,8,30,5,삼남매아빠_용자박,좋아요
52,20230829,2023,8,29,5,CHANYEOL,웬만한 명품 검색하면 대부분 있어요. 여러 곳 발품 파는 것 보다 발란 하나에서 보는게 편하구 좋네요!! 잘 찾으면 진짜 저렴한 제품들 많구요
53,20230829,2023,8,29,5,해피타임,검수 동영상 정성 대박 무엇… 영상까지 찍어주다니 ㅋㅋㅋ 넘 좋아요…. 계속 쓸게요!!
54,20230829,2023,8,29,5,오재호,"여성, 남성, 골프 등등 자세하게 카테고리 나누어져 있어서 편한데 골프 안에서도 또 여성, 남성, 용품 등등 나누어지니 골프 용품 사기에 정말 좋습니다!!"
55,20230829,2023,8,29,5,잠꼬대,명품 커머스중에서는 제일 최적화 잘 되어 있는 거 같아요. 다른 앱 쓰다가 빡쳐서 발란 쓰게 되네요 ㅠ
56,20230829,2023,8,29,5,슈퍼파월,발란을 설치하고부터는 명품 쇼핑의 질이 달라졌네요. 어디서든 앱만 키면 되니까 진짜 편리 ㅋㅋ
57,20230829,2023,8,29,5,김준우,직관성 있는 디자인 좋습니다. 앱으로 명품 쇼핑 쉽게 가능하니까 너무 좋네요. 집순이 친화적인 앱 ㅋㅋㅋ
58,20230829,2023,8,29,4,씨이이잉(씨이이잉),실물 사진이 부족한듣 합니다
59,20230828,2023,8,28,5,Google 사용자,구우웃
60,20230827,2023,8,27,5,박기진,핏도 이쁘고 고급스럽게 너무 이쁘네요. 맘에 듭니다.
61,20230824,2023,8,24,5,주나윤,"제가 선호하는 브랜드들의 제품들이 다양하게 구비되어 있고, 재고도 있어서 좋아요. 검색 필터 기능도 유용하고 한눈에 보기가 좋네요"
62,20230824,2023,8,24,5,채다연,신상들도 수시로 업데이트 되니 트렌드 맞게 구매하기가 좋아요
63,20230824,2023,8,24,5,러브로즈,요즘 인스타보다도 발란을 자주 보고 있어요 ㅋㅋㅋㅋ 제 취향 맞춰서 추천해주니까 보는 재미가 쏠쏠 ㅠㅠ
64,20230823,2023,8,23,5,인생개척,다양한 상품들 좋은 가격으로 핸드폰으로 바로 바로 살 수 있다니…. 번창하세요 ㅋㅋㅋ
65,20230823,2023,8,23,5,astronaut,꼭 명품 아니더라도 나이키 이런 인기 브랜드 제품들도 저렴하게 올라와서 좋네요~!
66,20230823,2023,8,23,5,기기기,좋아요~
67,20230823,2023,8,23,5,강시아,"낚시가 없어서 좋아요.. 첨부터 상품 가격에 관세랑 부가세, 배송비 포함이라서 ㅋㅋㅋㅋ"
68,20230822,2023,8,22,4,박연주,역시 가격좋고 배송빨라요
69,20230818,2023,8,18,2,김소영,앱에서 카카오로 로그인이 안되요
70,20230818,2023,8,18,5,김종인,좋아요
71,20230817,2023,8,17,5,김미옥,그냥싸서 좋은것같네요
72,20230816,2023,8,16,5,한기애,상품이 참 다양하고 개인쇼핑 스타일에 맞춰서 연관 상품도 자동으로 추천되고 리뷰도 다양해서 큰 도움이 됩니다.. 매월 행사도 잘 정리되어 있어요..
73,20230816,2023,8,16,5,노바우,같은 상품이라도 업체마다 가격이 달라서 가격비교하면서 사고 있습니다 정품보장되는 것도 마음에 들고요 간혹 브랜드 더스트백없이 오기도 하는데 이점은 아쉬워요 앞으로 점점 좋아질거라고 믿습니다
74,20230816,2023,8,16,5,[Real love],최저가로 명품을 구매 가능하네요!! 정품 걱정은 안해도 됩니다~~
75,20230814,2023,8,14,4,김은경,가격대가 너무 달라서 혼돈 스럽고 50만원 쿠폰의 의미를 10%할인으로 바꾸는게 정상일 듯
76,20230814,2023,8,14,5,신인영,정품 백퍼센트보장으로 믿고 구매하고 있습니다!! 친구들한테도 발란 추천하는 편입니다~~
77,20230814,2023,8,14,5,Hey smart,저의 최애 앱은 발란입니다.... 우연한 기회에 접하게 돼서 소소하게 지르고 이써요ㅎㅎ앞으로 더 많은 혜택이 있기를 바래요ㅎㅎ
78,20230813,2023,8,13,5,블루메,정품 명품은 무조건~ 발란!!! 몇년전 직구해보고 배송 한달 넘게 걸렸던 기억이 있는데 발란은 다음날 오는 제품도 있고 예상기간보다 더 빨리 오는 경우도 있어서 안심하고 이용하고 있습니다!!
79,20230812,2023,8,12,5,윤정희,오리진 명품을 좋은 가격으로 구매할수있어 너무 좋아요
80,20230811,2023,8,11,5,박경희,너무 싸게 구매한것 같아요
81,20230811,2023,8,11,5,김영우,굿입니다 잘신을께요
82,20230810,2023,8,10,5,수잔쌤,B최저가 메뉴 최고네요 좋은 가격으로 아이템을 구할 수 있어요 명품쇼핑앱이 여러 개 있지만 가장 손이 많이 가는 앱이에요
83,20230810,2023,8,10,5,여름빛새,연관상품을 볼수 있는 기능이 잘되 있어요!! 정품 직구 쉽고 편하게 방구석에서 가능함 딱히 불편한 점은 못 느꼈어요.
84,20230810,2023,8,10,5,김현정,원래 가지고 있던걸 버리게 돼서 사게 됐어요.변색도 거의없어서 애정하던건데 ㅎ
85,20230810,2023,8,10,5,Marco Woo,지금까진 만족이에요.
86,20230810,2023,8,10,5,KSY,"리퍼 세일, 발란 픽업 등 서비스 잘 살펴보세요 최저가보다도 싸게 나오는 템들이 있습니다. 오랫동안 이용해오면서 불만도 있지만 그래도 명품살때는 발란을 이용하게 되네요."
87,20230810,2023,8,10,5,도인성,"명품살때는 무조건 발란을 사용하는 1인입니다:) 명품이 아니라 나이키, 어그 등 구입할 때도 유용한 앱이예요. 메뉴가 다양한게 보기 쉽게 잘 구성한 것 같아요~ 네이버페이 카카오페이 돼서 조아요 뭣보다 정품이니까요"
88,20230809,2023,8,9,5,박예응,좋아요 이것저것 쿠폰쓰면 살만 합니다
89,20230809,2023,8,9,5,신사동그사람,지인이 발란서 구매한다고 해서 이용해 보고 있습니다. 판매자마다 포장 상태가 다르지만 대체적으로 잘 오는 편입니다. 리뷰쓰고 받은 포인트도 모으면 꽤돼서 포인트로 작은 악세서리도 주문하고 있습니다. 전반적으로 잘 이용하고 있습니다.
90,20230809,2023,8,9,5,박창환,"가장 많이 사용하는 쇼핑 어플입니다~ 어른, 아이 다양하게 상품이 구비되어 있어요. ㅋ ㅋ올 겨울 가족패딩은 전부 발란에서 샀습니다~정품등록도 완료~~"
91,20230809,2023,8,9,5,벼락부자가꿈,남친 생선으로 구찌 카드지갑을 주문했고 하루만인 오늘 받았어요 배송 정말 빠르고 매장에서 본것도 동일한 상품으로 하자없는 상품을 받았어요 너무 좋아서 앱리뷰도 남겨요 어그도 주문해놨는데 빨리 받고 싶어요!
92,20230809,2023,8,9,5,달달달님,어그 코케트 산다고 둘러보다가 가입했네요!! 가입 쿠폰해서 어그말고 여러가지로 샀어요 ㅎㅎ 걱정했는데 정품으로 맞게 잘 온 것 가타요 굿굿
93,20230808,2023,8,8,5,드티,빠른배송 믿을수있는 상품
94,20230808,2023,8,8,5,권요한,"검수하는 영상, 가격, 배송, 퀄리티 등등 모두부분이 괜찮습니다. 배송이 안 와서 cs문의햇었는데 배송기간은 오버됐지만 잘 응대해주셨습니다."
95,20230808,2023,8,8,5,하수연,"너무너무 좋아요! 매장에서 신어보고 사이즈가 품절이라 그냥 돌아왔는데, 발란에서 사이즈와 디자인 원하는 것으로 게 또했어용"
96,20230807,2023,8,7,5,메이저인생,잠들기 전에 아이쇼핑하기 좋아요ㅋㅋ매일 보고 있다가 가격 떨어지면 바로 사고 있어여ㅋㅋ
97,20230807,2023,8,7,5,러블랴,2번 사용해보니까 대만족! 정품 걱정없이 살 수 있음!!
98,20230806,2023,8,6,3,이은태,좋아요
99,20230806,2023,8,6,5,홍동한,"별다섯개인걸 친구가 알려줘서 가입하게 되었는데, 가격도 좋았고 물건도 잘 받았습니다ㅎㅎ 선물포장도 해주었는데 이건 판매자마자 다른가봐요?? 저는잘 골라서 산 듯합니다. 검수도 잘된 것 같아 다행이에요!!"
100,20230806,2023,8,6,5,현새봄,판매자별로 가격비교와 리뷰를 볼 수 있어서 판매자 초이스하는데 많은 도움이 되고 있어요 정품 구매 걱정없이 명품 저렴하게 살 수 있어서 좋아요 매장갈 수 없는 상황에 이용하기 너무 좋아요
101,20230805,2023,8,5,5,오은아,배송빠르고 물건 정확하고 만족 합니다. 자주 애용할게요
102,20230804,2023,8,4,4,신승용,좀더 저렴하면 좋겠네요
103,20230804,2023,8,4,3,김재용,굿
104,20230802,2023,8,2,5,젊은고수,가격이 너무 착해서 다~~ 담아두다보니 장바구니 터질거같아요 우선 담아두고 하나하나 덜어내려고햇는데 결국 다 지를것같네요ㅋ 가격이 넘 착해요
105,20230802,2023,8,2,5,삐삐츄,판매자가 정말 많아요 같은 물건인데도 판매자마다 다른 가격을 제시하는데 비교해서 사기가 좋음 B최저가만 봐도 최저가 확인은 가능함 후기도 보고 사진도 잘 째려보고 사고 있음 지금까지는 실패없었어요!!
106,20230802,2023,8,2,5,장규선,구찌 카드지갑 포장 완벽하게 잘 받았음. 발란 더스트백에 한번 더 담아져서 깔끔했음. 쇼핑백도 주면 좋겠는데 이건 주문상품마다 다른거 같음.
107,20230801,2023,8,1,5,백미자,저렴하게 구입하는 정보
108,20230801,2023,8,1,5,핫태,가격도 착해요
109,20230731,2023,7,31,5,송재혁,저렴한 가격에 너무 잘 구매했어요. 앞으로도 계속 이용하고 싶어요. 물건 좋은거 마니 올려주세요~~
110,20230730,2023,7,30,5,조윤경,"적립금 소멸된다길래 이벤트,쿠폰 등등 혜택 다 끌어모아서 또 하나 영입했어요^_^ 역시 빠르고 정확하네요. 감사합니당 적립금 마니마니!!!!"
111,20230730,2023,7,30,5,도수정,배송이 생각보다 걸리긴했는데..사전고시해주셔서 괜찮아요. 제품이 안전하게 잘 올수 있는게 중요하죠. 백화점보다 훨씬 저렴하게 좋은 가격에 샀어요!!
112,20230728,2023,7,28,1,Ryanghyun Kim,정품여부를 떠나서 중고파는것 같아요. 제품퀄리티 너무 낮아요
113,20230727,2023,7,27,5,나영필,해외배송 아닌거 같음ㅋㅋㅋㅋ 진짜 빠르고 좋아요.
114,20230727,2023,7,27,5,황현호,타 사이트에서 갈아탔습니다!! 우선 여태까지의 발란구매건은 대체적으로 만족스러워요. 정착할수있길....
115,20230727,2023,7,27,5,Jueun,핫딜정보공유로 자주 구매해요. 어디가서 이 가격에 샀다고하면 다들 놀래요. 보증서랑 큐알다 받았고 정품 보증해주니까 저는 늘 믿고이용합니다!!
116,20230726,2023,7,26,5,러브뽀미,상세설명이 좀 더 디테일하면 좋겠는데 그거야 뭐 공홈가서 확인하면 되니까 할인받는 수고비라칩니다. 상세설명 조금 더 디테일하면 완벽할듯요...
117,20230726,2023,7,26,5,함아림,어머니께 선물해서 드렸는데 마음에 쏙 들어하셨어요 기분좋네요 번창하세요^^
118,20230726,2023,7,26,5,도용준,날짜를 착각해서 빨리 오면좋겠다 좋겠다어요. 운이 좋은건지뭔지 필요한 날짜 딱 전날에 도착해서 잘 사용하고있네요ㅎㅎ
119,20230726,2023,7,26,5,홀로깨달음,남자친구 생일선물 사느라 가입했는데 제거 보느라 시간가는줄몰랐어요ㅋㅋㅋㅋ 예쁜 제품 많네요.. 신상 업뎃많이 해주세용~
120,20230726,2023,7,26,5,은혜갚은호랑이,"가끔 기사님의 박력으로 택배상태가 안좋을때가 있는데, 발란에서 잘 포장해주셔서 문제없이 받았어요. 꼼꼼한 포장 감사합니다ㅎㅎ"
121,20230725,2023,7,25,5,공영선,해외배송 아닌거같음ㅋㅋㅋㅋ 진짜 빠르고 좋아요!
122,20230724,2023,7,24,4,김미쓰,가격과 제품 모두 만족합니다
123,20230724,2023,7,24,5,안하임,상품 도착 예정일에 맞춰서 잘 도착했어요. 반신반의했는데. 두번째 구매도 만족입니다!!
124,20230721,2023,7,21,5,Eric Kim (Eric Kim),편리하네요.
125,20230721,2023,7,21,5,정나희,트렌드에 빠르고 젊고~~ 영한 느낌이에요! 좋아요
126,20230721,2023,7,21,5,윤태영,인터넷 최저가 검색하는데 같은 판매자인데 발란에서 더 저렴하게 팔매하길래 이용했어요. 쿠폰까지 적용하니 최~~최저가네요!
127,20230720,2023,7,20,5,ᄌᄇᄋᄀᄃᄀ,조아요
128,20230720,2023,7,20,5,조영민,가격과 품질 최고죠!!!
129,20230719,2023,7,19,5,지찬영,선물할 때나 뭐 사고 싶을 때 주기적으로 들어가는 재미가 있어요. 쿠폰도 많이 주고 제품도 다양하고 금액대별 검색도 가능해서 편해요!!
130,20230719,2023,7,19,5,하늘느낌,항상 꾸준히 사용하고 있습니다~! 통장에 구멍난 지 오래예요 ㅠㅠ
131,20230718,2023,7,18,5,정예지,앱 ui도 ux도 편리하고~! 모델도 제가 좋아하는 혜수님이라 정말 좋네요 ㅎㅎ. 잘 쓰고 있어요~~~
132,20230717,2023,7,17,5,마동숙,급할때 좋아여
133,20230717,2023,7,17,5,활활,유사한 명품 커머스보다 저렴한 상품들이 많이 있네요. 경쟁력 있어서 넘 좋아요!!
134,20230716,2023,7,16,5,윤소정,회원 혜택이 진짜 좋은 거 같아요! 쿠폰팩도 주고 적립금도 빵빵하고 ㅎㅎㅎ 네페로 결제하면 적립금이 배로 쌓이니 좋네요!!
135,20230716,2023,7,16,5,백재현,좋아요~
136,20230713,2023,7,13,5,고광옥,가격 착하고 배송도 빠르고 가방은 말할것도 없고 망설임은 가격만 올릴뿐 몇일 사이에 가격이 더 올랐네요 명품은 지금이 제일 저렴 하다는게 맞는듯 합니다 망설이지 마시고 구매하세요
137,20230712,2023,7,12,3,Google 사용자,사용불편
138,20230712,2023,7,12,5,최주용,good
139,20230712,2023,7,12,5,이후원,굿
140,20230711,2023,7,11,4,지정일,좋아요
141,20230710,2023,7,10,5,썸싱스페샬,면세보다 저렴해서 면세점 이용이 줄었어요 해외나가는 지인한테 가끔 부탁할때 있었는데 이제는 부탁안하고 발란에서 다 해결해요
142,20230710,2023,7,10,5,Latham,직구할 줄 몰라서 원래부터 오프라인 매장만 주구장창 갔었는데 발란앱 알고 나서는 여기서만 사네요!!
143,20230710,2023,7,10,5,김상수,저렴하구 너무 좋은거같아요.^^
144,20230709,2023,7,9,5,taeyoung heo,좋앙르
145,20230708,2023,7,8,5,Y.A L,찾다찾다 발견했습니다
146,20230707,2023,7,7,5,정찬호,굿
147,20230704,2023,7,4,5,남이솔,톰브라운 가디건 저렴하게 잘 샀어요ㅎ 정품 확실하네요ㅎㅎ
148,20230704,2023,7,4,5,쁘유,상품마다 가격비교를 바로바로 할 수 있게 떠있는 거 조아요 안그러면 하나하나 다찾아봐야되는데 시간절약에 굿입니당 판매자 후기도 볼수있으니 그것도 보면 더 조아💙💚
149,20230704,2023,7,4,5,염채율,"선착순특가, 발란 바잉템등 시간날때마다 들어가서 보면서 가격 떨어지면 바로바로 삽니다ㅋㅋ 알림 신청 필수에요ㅜㅜ"
150,20230704,2023,7,4,5,파우스트,정품 등록되는거 보고 안심..가격이 너무 저렴해서 의심했는데 잘 샀습니다..앞으로도 조은 물건 마니 부탁합니다..
151,20230704,2023,7,4,5,수채화,여의도 IFC몰에서 이용해보고 갠찬아서 앱 이용도 종종 하고 있습니당ㅋㅋ 얼마전에 나이트특가로 스카프도 삿네요 나이트특가 굿 이런거 마니 만들어주십시요
152,20230703,2023,7,3,5,김간지,내가 원하는 제품을 찾을수 있어서 좋아요
